{
  "checkouts": [
    {
      "branch": "feat/paw-pii-extension-example",
      "dirty": 0,
      "head": "1771ad4000000000000000000000000000000000",
      "origin": "kvnloo/oh-my-pi",
      "path": "~/workspace/oh-my-pi",
      "pin_is_ancestor": false,
      "pin_present": true
    },
    {
      "branch": "master",
      "dirty": 0,
      "head": "65e8f2dd9d6c5784a2a1c67f5236d69a5ae94021",
      "origin": "kvnloo/tokenomics",
      "path": "~/workspace/tokenomics",
      "pin_is_ancestor": true,
      "pin_present": true
    },
    {
      "branch": "main",
      "dirty": 0,
      "head": "29a28336e526edfb4c3913c30df6eff12b28b2d6",
      "origin": "kvnloo/z0evals",
      "path": "~/workspace/z0evals",
      "pin_is_ancestor": true,
      "pin_present": true
    },
    {
      "branch": "feat/claude-code-harness",
      "dirty": 7,
      "head": "46e3d06000000000000000000000000000000000",
      "origin": "kvnloo/z0intelligence",
      "path": "~/workspace/z0intelligence",
      "pin_is_ancestor": false,
      "pin_present": true
    }
  ],
  "detected_at": "2026-10-25T00:00:00Z",
  "hardware": {
    "cpu": {
      "logical": 8,
      "physical": 4
    },
    "disks": [
      {
        "free_gib": 106.7,
        "mount": "~",
        "role": [
          "z0_home",
          "home"
        ],
        "total_gib": 465.0
      }
    ],
    "gpu": {
      "class": "amd",
      "rocm": false
    },
    "ram_gib": 15.5
  },
  "harnesses": {
    "claude-code": {
      "config_dirs": [
        "~/.claude"
      ],
      "path": "~/.local/bin/claude",
      "sessions_present": true,
      "state": "installed",
      "version": "2.1.310"
    },
    "codex": {
      "config_dirs": [
        "~/.codex"
      ],
      "path": "~/.local/bin/codex",
      "sessions_present": true,
      "state": "installed",
      "version": "0.162.1"
    },
    "codexbar": {
      "path": "~/.local/bin/codexbar",
      "state": "installed"
    },
    "cursor-agent": {
      "policy_excluded": true,
      "state": "absent"
    },
    "deepseek": {
      "state": "absent"
    },
    "dsh": {
      "state": "absent"
    },
    "fx": {
      "path": "~/.local/bin/fx",
      "state": "installed"
    },
    "gemini": {
      "state": "absent"
    },
    "grok": {
      "bin_dir": "~/.local/bin",
      "config_dirs": [
        "~/.grok"
      ],
      "policy_excluded": true,
      "state": "installed"
    },
    "hermes": {
      "config_dirs": [
        "~/.hermes"
      ],
      "path": "~/.local/bin/hermes",
      "state": "installed"
    },
    "kimi": {
      "state": "absent"
    },
    "omp": {
      "config_dirs": [
        "~/.omp"
      ],
      "path": "~/.bun/bin/omp",
      "state": "installed"
    },
    "opencode": {
      "config_dirs": [
        "~/.config/opencode"
      ],
      "state": "config_only"
    },
    "pi": {
      "config_dirs": [
        "~/.pi"
      ],
      "state": "config_only"
    }
  },
  "host_id": "0a1b2c3d4e5f6071",
  "network": {
    "bun": true,
    "fonts_google": true,
    "github": true,
    "k2_fsa": true,
    "npmjs": true,
    "pypi": true,
    "pytorch": true
  },
  "os": {
    "arch": "x86_64",
    "distro": "arch",
    "libc": "glibc",
    "os": "linux",
    "pep668": true,
    "pkg_manager": "pacman"
  },
  "prepared_path": [
    "~/.local/bin",
    "~/.bun/bin",
    "~/.cargo/bin",
    "/usr/bin",
    "/bin"
  ],
  "python_window": "present",
  "revs": {
    "1c9b5235d341f9108d6ea4cc886592be7004ef28": {
      "evidence": "checkout",
      "flavour": "unknown",
      "on_origin": "yes",
      "repo": "kvnloo/evolution-lab"
    },
    "22b4c0f1088abfef6184840cb79a0a6a6aceda44": {
      "evidence": "checkout",
      "flavour": "unknown",
      "on_origin": "yes",
      "repo": "kvnloo/frontier-kb"
    },
    "29a28336e526edfb4c3913c30df6eff12b28b2d6": {
      "evidence": "checkout",
      "flavour": "unknown",
      "on_origin": "yes",
      "repo": "kvnloo/z0evals"
    },
    "416736c80a727757202bdeedb02579c3c820f7f6": {
      "evidence": "checkout",
      "flavour": "unknown",
      "on_origin": "yes",
      "repo": "kvnloo/aodl"
    },
    "513a80c2ba155115dfcea0bc808b0c41a1fd4380": {
      "evidence": "checkout",
      "flavour": "unknown",
      "on_origin": "yes",
      "repo": "kvnloo/Memento"
    },
    "5259013185d97422022fc225fa70245595b046ea": {
      "evidence": "checkout",
      "flavour": "unknown",
      "on_origin": "yes",
      "repo": "kvnloo/.files"
    },
    "5f3ee27f6e431ba83abfe9a4a94b2c0757910ddb": {
      "evidence": "none",
      "flavour": "current",
      "on_origin": "unknown",
      "repo": "kvnloo/dash"
    },
    "65e8f2dd9d6c5784a2a1c67f5236d69a5ae94021": {
      "evidence": "checkout",
      "flavour": "unknown",
      "on_origin": "yes",
      "repo": "kvnloo/tokenomics"
    },
    "6848aa10df9dae7034a7bfeaf9f51a7d55424862": {
      "evidence": "checkout",
      "flavour": "unknown",
      "on_origin": "yes",
      "repo": "kvnloo/agenttrace"
    },
    "cdb43b05a328a50649d5120bffcdecea09492219": {
      "evidence": "checkout",
      "flavour": "unknown",
      "on_origin": "yes",
      "repo": "kvnloo/kerdoios"
    },
    "cfb33e5fabafe198c622f9178af18b4bc56749e7": {
      "evidence": "checkout",
      "flavour": "unknown",
      "on_origin": "yes",
      "repo": "kvnloo/z0intelligence"
    },
    "cfc08de155aed50c9f6b6f9dd8e1a4a9f25aad72": {
      "evidence": "none",
      "flavour": "current",
      "on_origin": "unknown",
      "repo": "kvnloo/dash"
    },
    "d707478d4c5c72784c058a0163b616988f559230": {
      "evidence": "checkout",
      "flavour": "unknown",
      "on_origin": "yes",
      "repo": "kvnloo/oh-my-pi"
    }
  },
  "secrets": {
    "AI_GATEWAY_API_KEY": {
      "present": false
    },
    "CEREBRAS_API_KEY": {
      "present": false
    },
    "DEEPSEEK_API_KEY": {
      "present": false
    },
    "GROQ_API_KEY": {
      "present": false
    },
    "NVIDIA_API_KEY": {
      "present": false
    },
    "OPENROUTER_API_KEY": {
      "present": false
    },
    "dash_bootstrap_token": {
      "present": false
    },
    "dash_dir": {
      "present": false
    },
    "dash_token": {
      "present": false
    }
  },
  "services": {
    "port_owners": {},
    "units": []
  },
  "session": {
    "audio_in": true,
    "desktop": "hyprland",
    "launchd": false,
    "linger": true,
    "systemd_user": true
  },
  "tailscale": {
    "installed": true,
    "logged_in": false
  },
  "toolchains": {
    "bun": {
      "path": "~/.bun/bin/bun",
      "sh_resolves": true,
      "source": "well_known_dir",
      "state": "present",
      "version": "1.4.3"
    },
    "curl": {
      "path": "/usr/bin/curl",
      "sh_resolves": true,
      "source": "path",
      "state": "present"
    },
    "ffmpeg": {
      "path": "/usr/bin/ffmpeg",
      "sh_resolves": true,
      "source": "path",
      "state": "present",
      "version": "9.0.1"
    },
    "git": {
      "path": "/usr/bin/git",
      "sh_resolves": true,
      "source": "path",
      "state": "present",
      "version": "2.55.0"
    },
    "node": {
      "path": "/usr/bin/node",
      "sh_resolves": true,
      "source": "path",
      "state": "present",
      "version": "26.8.1"
    },
    "npm": {
      "path": "/usr/bin/npm",
      "sh_resolves": true,
      "source": "path",
      "state": "present",
      "version": "12.0.2"
    },
    "python3": {
      "path": "/usr/bin/python3",
      "sh_resolves": true,
      "source": "path",
      "state": "present",
      "version": "3.14.7"
    },
    "rustup": {
      "path": "~/.cargo/bin/rustup",
      "sh_resolves": true,
      "source": "well_known_dir",
      "state": "present",
      "version": "1.29.1"
    },
    "tailscale": {
      "path": "/usr/bin/tailscale",
      "sh_resolves": true,
      "source": "path",
      "state": "present"
    },
    "uv": {
      "path": "~/.local/bin/uv",
      "sh_resolves": true,
      "source": "well_known_dir",
      "state": "present",
      "version": "0.12.21"
    }
  },
  "unknowns": [
    {
      "candidates": [
        "claude-code",
        "codex",
        "unsupported"
      ],
      "facts": {
        "dir": "~/.local/bin",
        "name": "herdr"
      },
      "id": "bin.herdr",
      "kind": "harness_classify",
      "safe_default": "unsupported"
    }
  ],
  "version": 1,
  "warnings": [],
  "workspace": {
    "host_match": "fresh",
    "owned": [
      "~/workspace/oh-my-pi/node_modules",
      "~/workspace/z0evals/site/index.html"
    ],
    "stamps": []
  }
}
