{
  "checkouts": [
    {
      "branch": "main",
      "dirty": 0,
      "head": "29a28336e526edfb4c3913c30df6eff12b28b2d6",
      "origin": "kvnloo/z0evals",
      "path": "~/zer0/oss/z0evals",
      "pin_is_ancestor": true,
      "pin_present": true
    },
    {
      "branch": "feat/x",
      "dirty": 3,
      "head": "46e3d0600000000000000000000000000000000a",
      "origin": "kvnloo/z0intelligence",
      "path": "~/zer0/oss/z0intelligence",
      "pin_is_ancestor": true,
      "pin_present": true
    }
  ],
  "detected_at": "2026-10-25T00:00:00Z",
  "hardware": {
    "cpu": {
      "logical": 20,
      "physical": 10
    },
    "disks": [
      {
        "free_gib": 812.4,
        "mount": "~",
        "role": [
          "z0_home",
          "home"
        ],
        "total_gib": 1863.0
      }
    ],
    "gpu": {
      "class": "nvidia",
      "cuda_max": "13.0",
      "driver": "580.95.05",
      "vram_gib": 12.0
    },
    "ram_gib": 31.2
  },
  "harnesses": {
    "claude-code": {
      "config_dirs": [
        "~/.claude-home"
      ],
      "overrides": {
        "CLAUDE_CONFIG_DIR": "~/.claude-home"
      },
      "sessions_present": true,
      "state": "installed",
      "version": "2.1.310"
    },
    "codex": {
      "config_dirs": [
        "~/.codex"
      ],
      "sessions_present": true,
      "state": "installed",
      "version": "0.162.1"
    },
    "codexbar": {
      "state": "absent"
    },
    "cursor-agent": {
      "policy_excluded": true,
      "state": "absent"
    },
    "deepseek": {
      "state": "absent"
    },
    "dsh": {
      "state": "absent"
    },
    "fx": {
      "state": "absent"
    },
    "gemini": {
      "state": "absent"
    },
    "grok": {
      "config_dirs": [
        "~/.grok"
      ],
      "policy_excluded": true,
      "state": "installed"
    },
    "hermes": {
      "config_dirs": [
        "~/.hermes"
      ],
      "state": "installed"
    },
    "kimi": {
      "state": "absent"
    },
    "omp": {
      "config_dirs": [
        "~/.omp"
      ],
      "state": "installed",
      "version": "14.2.0"
    },
    "opencode": {
      "state": "absent"
    },
    "pi": {
      "state": "absent"
    }
  },
  "host_id": "1f2e3d4c5b6a7980",
  "network": {
    "bun": true,
    "fonts_google": true,
    "github": true,
    "k2_fsa": true,
    "npmjs": true,
    "pypi": true,
    "pytorch": true
  },
  "os": {
    "arch": "x86_64",
    "distro": "arch",
    "libc": "glibc",
    "os": "linux",
    "pep668": true,
    "pkg_manager": "pacman"
  },
  "prepared_path": [
    "~/.local/bin",
    "~/.bun/bin",
    "/usr/bin",
    "/bin"
  ],
  "python_window": "present",
  "revs": {
    "1c9b5235d341f9108d6ea4cc886592be7004ef28": {
      "evidence": "mirror",
      "flavour": "unknown",
      "on_origin": "yes",
      "repo": "kvnloo/evolution-lab"
    },
    "22b4c0f1088abfef6184840cb79a0a6a6aceda44": {
      "evidence": "mirror",
      "flavour": "unknown",
      "on_origin": "yes",
      "repo": "kvnloo/frontier-kb"
    },
    "29a28336e526edfb4c3913c30df6eff12b28b2d6": {
      "evidence": "mirror",
      "flavour": "unknown",
      "on_origin": "yes",
      "repo": "kvnloo/z0evals"
    },
    "416736c80a727757202bdeedb02579c3c820f7f6": {
      "evidence": "mirror",
      "flavour": "unknown",
      "on_origin": "yes",
      "repo": "kvnloo/aodl"
    },
    "513a80c2ba155115dfcea0bc808b0c41a1fd4380": {
      "evidence": "mirror",
      "flavour": "unknown",
      "on_origin": "yes",
      "repo": "kvnloo/Memento"
    },
    "5259013185d97422022fc225fa70245595b046ea": {
      "evidence": "mirror",
      "flavour": "unknown",
      "on_origin": "yes",
      "repo": "kvnloo/.files"
    },
    "5f3ee27f6e431ba83abfe9a4a94b2c0757910ddb": {
      "evidence": "mirror",
      "flavour": "current",
      "on_origin": "yes",
      "repo": "kvnloo/dash"
    },
    "65e8f2dd9d6c5784a2a1c67f5236d69a5ae94021": {
      "evidence": "mirror",
      "flavour": "unknown",
      "on_origin": "yes",
      "repo": "kvnloo/tokenomics"
    },
    "6848aa10df9dae7034a7bfeaf9f51a7d55424862": {
      "evidence": "mirror",
      "flavour": "unknown",
      "on_origin": "yes",
      "repo": "kvnloo/agenttrace"
    },
    "cdb43b05a328a50649d5120bffcdecea09492219": {
      "evidence": "mirror",
      "flavour": "unknown",
      "on_origin": "yes",
      "repo": "kvnloo/kerdoios"
    },
    "cfb33e5fabafe198c622f9178af18b4bc56749e7": {
      "evidence": "mirror",
      "flavour": "unknown",
      "on_origin": "yes",
      "repo": "kvnloo/z0intelligence"
    },
    "cfc08de155aed50c9f6b6f9dd8e1a4a9f25aad72": {
      "evidence": "mirror",
      "flavour": "current",
      "on_origin": "yes",
      "repo": "kvnloo/dash"
    },
    "d707478d4c5c72784c058a0163b616988f559230": {
      "evidence": "mirror",
      "flavour": "unknown",
      "on_origin": "yes",
      "repo": "kvnloo/oh-my-pi"
    }
  },
  "secrets": {
    "AI_GATEWAY_API_KEY": {
      "present": false
    },
    "CEREBRAS_API_KEY": {
      "present": true
    },
    "DEEPSEEK_API_KEY": {
      "present": false
    },
    "GROQ_API_KEY": {
      "present": false
    },
    "NVIDIA_API_KEY": {
      "present": false
    },
    "OPENROUTER_API_KEY": {
      "present": false
    },
    "dash_bootstrap_token": {
      "mode_ok": true,
      "present": true
    },
    "dash_dir": {
      "mode_ok": true,
      "present": true
    },
    "dash_token": {
      "mode_ok": true,
      "present": true
    }
  },
  "services": {
    "port_owners": {
      "11501": "python3",
      "4747": "bun"
    },
    "units": [
      {
        "active": true,
        "deployed_sha": "5f3ee27f6e431ba83abfe9a4a94b2c0757910ddb",
        "exec_root_kind": "release",
        "manager": "systemd_user",
        "name": "dash-bridge.service"
      },
      {
        "active": true,
        "deployed_sha": "0563ed7a52071cca63ccc91b8c9040207ad23e5d",
        "exec_root_kind": "release",
        "manager": "systemd_user",
        "name": "z0intelligence.service"
      }
    ]
  },
  "session": {
    "audio_in": false,
    "desktop": "none",
    "launchd": false,
    "linger": true,
    "systemd_user": true
  },
  "tailscale": {
    "installed": true,
    "ipv4": "100.64.0.2",
    "logged_in": true,
    "magicdns": "groot.example.ts.net"
  },
  "toolchains": {
    "bun": {
      "path": "~/.bun/bin/bun",
      "sh_resolves": true,
      "source": "well_known_dir",
      "state": "present",
      "version": "1.3.14"
    },
    "curl": {
      "path": "/usr/bin/curl",
      "sh_resolves": true,
      "source": "path",
      "state": "present"
    },
    "ffmpeg": {
      "path": "/usr/bin/ffmpeg",
      "sh_resolves": true,
      "source": "path",
      "state": "present",
      "version": "8.0.1"
    },
    "git": {
      "path": "/usr/bin/git",
      "sh_resolves": true,
      "source": "path",
      "state": "present",
      "version": "2.55.0"
    },
    "node": {
      "path": "/usr/bin/node",
      "sh_resolves": true,
      "source": "path",
      "state": "present",
      "version": "22.23.4"
    },
    "npm": {
      "path": "/usr/bin/npm",
      "sh_resolves": true,
      "source": "path",
      "state": "present",
      "version": "10.9.4"
    },
    "python3": {
      "path": "/usr/bin/python3",
      "sh_resolves": true,
      "source": "path",
      "state": "present",
      "version": "3.12.12"
    },
    "rustup": {
      "state": "absent"
    },
    "tailscale": {
      "path": "/usr/bin/tailscale",
      "sh_resolves": true,
      "source": "path",
      "state": "present"
    },
    "uv": {
      "path": "~/.local/bin/uv",
      "sh_resolves": true,
      "source": "well_known_dir",
      "state": "present",
      "version": "0.12.21"
    }
  },
  "unknowns": [],
  "version": 1,
  "warnings": [],
  "workspace": {
    "host_match": "same",
    "owned": [
      "$Z0_HOME/repos/tokenomics",
      "$Z0_HOME/repos/oh-my-pi",
      "~/.local/lib/dash/releases/5f3ee27f6e431ba83abfe9a4a94b2c0757910ddb",
      "~/.config/dash-services/bridge.env",
      "~/.local/lib/dash/bin/dash-wait-tailnet",
      "~/.config/systemd/user/dash-bridge.service",
      "~/.local/lib/dash/bridge-current"
    ],
    "recorded_host_id": "1f2e3d4c5b6a7980",
    "stamps": [
      "~/.local/share/dash/deployed.json"
    ]
  }
}
